{
  "schema": "minhtri-master-blueprint-recovery-response/v6",
  "challenge_id": "ARCH-MASTER-BLUEPRINT-RECOVERY-V6-20261007-C6",
  "challenge_nonce": "mtv6-2f4ecb822a09-20261007",
  "attestations": {
    "separate_zero_chat": true,
    "used_prior_chat_history": false,
    "read_snapshot": false
  },
  "recovered_facts": {
    "master_blueprint": {
      "path": "docs/vnext/MASTER_BLUEPRINT_V1_20261006.md",
      "status": "OWNER-RATIFIED FOUNDATION ARCHITECTURE — RECOVERY PROOF v6 PENDING",
      "acceptance_record": "docs/vnext/OWNER_DECISION_MASTER_BLUEPRINT_V1_POST_MERGE_RATIFICATION_20261007.md",
      "owner_acceptance_effective_date": "2026-10-07",
      "owner_acceptance_prospective": true,
      "owner_acceptance_backdated": false,
      "historical_process_defect": "POST_MERGE_ACCEPTANCE_ORDER_VIOLATION",
      "historical_pr300_merge_commit": "174d8817730063d51f6682c31e5f067094bcef95",
      "structural_authority": "Highest project-wide structural-design authority, constrained by constitution-level Owner decisions and applicable Stable Foundation Law.",
      "second_law_precedence_router": false
    },
    "law_precedence": {
      "path": "docs/vnext/FOUNDATION_LAW_CONSOLIDATED_V1_20261006.md",
      "status": "CURRENT CONSOLIDATED LAW ROUTER / PRESERVES SOURCE LAW HISTORY",
      "order": [
        "Durable constitution-level Owner decision recorded on protected main",
        "Stable Owner law",
        "Policy",
        "Domain rule",
        "ADR / bounded operational decision",
        "Current state and task registry as operational truth, not law",
        "Historical/candidate records as evidence/provenance only",
        "Chat memory and chat-only instructions are non-canonical for future project-wide precedence"
      ],
      "law_index_catalog": "docs/LAW_INDEX_20261003.md",
      "law_index_is_precedence_authority": false,
      "missing_or_conflicting_required_authority": "FAIL_CLOSED_FOR_AFFECTED_MUTATION"
    },
    "current_state": {
      "path": "state/current.yaml",
      "boot_root": "state/bootstrap.json",
      "task_registry": "state/tasks.yaml",
      "architecture_generation": "VNEXT_MASTER_BLUEPRINT_V1_OWNER_RATIFIED",
      "phase": "RECOVERY_PROOF_V6_EXECUTION_GATE",
      "durable_continuity_authority": "GITHUB_PROTECTED_MAIN",
      "current_architecture": "docs/vnext/MASTER_BLUEPRINT_V1_20261006.md",
      "active_workstream": "ARCHITECTURE_RECOVERY_PROOF_V6",
      "active_task_id": "ARCH-MASTER-BLUEPRINT-V1",
      "autonomous_learning_runtime": false,
      "automatic_self_critique_runtime": false,
      "meta_learning_runtime": false,
      "pc_local_brain_role": "NON_CANONICAL_EXECUTION_AND_MIRROR_SIDECAR",
      "next_checkpoint": "After the Recovery Proof v6 harness is merged to protected main and fresh-read, run one independent separate zero-chat response from eval/recovery/v6/challenge.json; preserve deterministic score and durable independence receipt before any Foundation Freeze."
    },
    "active_task": {
      "task_id": "ARCH-MASTER-BLUEPRINT-V1",
      "status": "IN_PROGRESS",
      "change_class": "F",
      "acceptance_authority": "OWNER",
      "requires": "none",
      "holder": "CHATGPT_CURRENT_OPERATING_SEAT",
      "role": "TOTAL_ARCHITECT_RECOVERY_V6_FRESH_SEAT_GATE_NON_INDEPENDENT",
      "branch": "owner/recovery-v6-post-harness-reconcile-20261007",
      "base_sha": "813c3e7d44c95b32420a28d643da75388dc36070",
      "handoff_ref": "docs/vnext/handoff/MASTER_BLUEPRINT_V1.md",
      "blocker": "RECOVERY_PROOF_V6_FRESH_SEAT_RESPONSE_AND_DURABLE_RECEIPT_REQUIRED",
      "recovery_v6_harness_merged": true,
      "recovery_v6_harness_merge_sha": "813c3e7d44c95b32420a28d643da75388dc36070",
      "foundation_freeze_completed": false,
      "next_action": "After the Recovery Proof v6 harness is merged to protected main and fresh-read, run one independent separate zero-chat response from eval/recovery/v6/challenge.json; preserve deterministic score and durable independence receipt before any Foundation Freeze."
    },
    "next_action": "After the Recovery Proof v6 harness is merged to protected main and fresh-read, run one independent separate zero-chat response from eval/recovery/v6/challenge.json; preserve deterministic score and durable independence receipt before any Foundation Freeze."
  },
  "evidence_refs": [
    "state/bootstrap.json",
    "docs/vnext/MASTER_BLUEPRINT_V1_20261006.md",
    "docs/vnext/FOUNDATION_LAW_CONSOLIDATED_V1_20261006.md",
    "state/current.yaml",
    "state/tasks.yaml",
    "docs/vnext/handoff/MASTER_BLUEPRINT_V1.md",
    "docs/vnext/OWNER_DECISION_MASTER_BLUEPRINT_V1_POST_MERGE_RATIFICATION_20261007.md",
    "docs/LAW_INDEX_20261003.md",
    "docs/vnext/continuity/RECOVERY_ENTRYPOINT_V1.md",
    "eval/recovery/v6/challenge.json",
    "eval/recovery/v6/packet.json",
    "eval/recovery/v6/response.schema.json",
    "tools/score_master_blueprint_recovery_v6.py",
    "docs/GITHUB_FIRST_ROLE_BOOTSTRAP_20261002.md"
  ],
  "answers": {
    "Q1": "The first repository content read was state/bootstrap.json on main. I followed its Master Blueprint and law-precedence pointers, then state/current.yaml, state/tasks.yaml, the current-architecture pointer, and the active-task handoff. The current architecture resolves to the same Master Blueprint. The bootstrap, state, registry, and handoff agree on the active task and exact next action. My live main-versus-main metadata observation identified protected-main commit 60b670fbb3c66d06da4a65a7d559d6fabee5a278; this differs from the packet's explicitly pre-harness target and the recorded harness merge SHA.",
    "Q2": "MINH TRÍ is an Owner-directed knowledge and execution organization designed to survive replacement of chats, models, providers, tools, and PCs. The routed Master Blueprint is Owner-ratified foundation architecture with Recovery Proof v6 pending. It defines project-wide structure, roles, lifecycle, stable foundation, extensible zones, and canonical-source topology. It is structural authority subject to constitution-level Owner decisions and Stable Law, and is not a second law router.",
    "Q3": "The sole normative law-precedence router is docs/vnext/FOUNDATION_LAW_CONSOLIDATED_V1_20261006.md. Precedence runs from durable constitution-level Owner decisions through Stable Owner law, policy, domain rules, ADR/bounded operational decisions, operational state/task truth, historical/candidate provenance, and finally non-canonical chat memory. The Law Index is discovery/catalog only. Same-level conflict requires explicit supersession or a bounded conflict-resolution task; missing or conflicting required authority fails closed for the affected mutation.",
    "Q4": "Current state records architecture generation VNEXT_MASTER_BLUEPRINT_V1_OWNER_RATIFIED, phase RECOVERY_PROOF_V6_EXECUTION_GATE, workstream ARCHITECTURE_RECOVERY_PROOF_V6, and active task ARCH-MASTER-BLUEPRINT-V1. That exact registry task is IN_PROGRESS, Class F, with OWNER acceptance authority and handoff docs/vnext/handoff/MASTER_BLUEPRINT_V1.md. Its blocker is RECOVERY_PROOF_V6_FRESH_SEAT_RESPONSE_AND_DURABLE_RECEIPT_REQUIRED. Autonomous learning, automatic self-critique, and meta-learning runtimes are false. PC/Local Brain is a non-canonical execution and mirror sidecar.",
    "Q5": "Owner acceptance is prospective from the durable 2026-10-07 post-merge ratification. It is not evidence of acceptance before PR #300 merged; POST_MERGE_ACCEPTANCE_ORDER_VIOLATION remains preserved. Critic review and CI do not substitute for Owner acceptance. Protected main is canonical; unmerged branches, legacy migrated control semantics, and chat notes cannot override it. The active handoff records the v6 harness merged and fresh-read, but the independent v6 response, deterministic score, and durable receipt are still outstanding in that canonical record. Foundation Freeze has not occurred and remains blocked until the v6 evidence requirements are fulfilled.",
    "Q6": "After the Recovery Proof v6 harness is merged to protected main and fresh-read, run one independent separate zero-chat response from eval/recovery/v6/challenge.json; preserve deterministic score and durable independence receipt before any Foundation Freeze. The handoff NEXT ACTION is authoritative; task next_action and current-state next_checkpoint agree with it. Completion requires deterministic score PASS, independence provenance PRESENT, and a merged durable receipt, all bound to the protected-main proof target. I have not executed a scorer, read any snapshot/gold or prior attempts, or claimed a score or merged receipt for this response. The published response schema defines recovered_facts only as an object and supplies no Q1–Q6 question wording; the permitted scorer source compares to an excluded snapshot without publishing its nested key contract. This response therefore reports facts recovered from allowed canonical inputs without claiming recovery of that hidden exact key contract."
  }
}
